Lens ID,Title,Date Published,Publication Year,Publication Type,Source Title,ISSNs,Publisher,Source Country,Author/s,Abstract,Volume,Issue Number,Start Page,End Page,Fields of Study,Keywords,MeSH Terms,Chemicals,Funding,Source URLs,External URL,PMID,DOI,Microsoft Academic ID,PMCID,Citing Patents Count,References,Citing Works Count,Is Open Access,Open Access License,Open Access Colour
023-117-193-485-351,Analytic representations of Yang–Mills amplitudes,,2016,journal article,Nuclear Physics B,05503213,Elsevier BV,Netherlands,N. E. J. Bjerrum-Bohr; Jacob L. Bourjaily; Poul H. Damgaard; Bo Feng,"Scattering amplitudes in Yang–Mills theory can be represented in the formalism of Cachazo, He and Yuan (CHY) as integrals over an auxiliary projective space—fully localized on the support of the scattering equations. Because solving the scattering equations is difficult and summing over the solutions algebraically complex, a method of directly integrating the terms that appear in this representation has long been sought. We solve this important open problem by first rewriting the terms in a manifestly Mobius-invariant form and then using monodromy relations (inspired by analogy to string theory) to decompose terms into those for which combinatorial rules of integration are known. The result is the foundations of a systematic procedure to obtain analytic, covariant forms of Yang–Mills tree-amplitudes for any number of external legs and in any number of dimensions. As examples, we provide compact analytic expressions for amplitudes involving up to six gluons of arbitrary helicities.",913,,964,986,Physics; Scattering amplitude; Rewriting; Combinatorial principles; Yang–Mills existence and mass gap; Open problem; Mathematical physics; String theory; Quantum mechanics; Covariant transformation; Monodromy,,,,MOBILEX research grant from the Danish Council for Independent Research; National Science Foundation of China; NSFC; NSFC; NSFC,https://pennstate.pure.elsevier.com/en/publications/analytic-representations-of-yangmills-amplitudes http://inspirehep.net/record/1464869 https://www.sciencedirect.com/science/article/pii/S0550321316303145 https://arxiv.org/pdf/1605.06501.pdf https://www.arxiv-vanity.com/papers/1605.06501/ https://www.arxiv.org/abs/1605.06501 https://inspirehep.net/literature/1464869 https://ui.adsabs.harvard.edu/abs/2016NuPhB.913..964B/abstract https://core.ac.uk/display/81114039 https://core.ac.uk/download/269281974.pdf,http://dx.doi.org/10.1016/j.nuclphysb.2016.10.012,,10.1016/j.nuclphysb.2016.10.012,2406305832,,0,002-934-577-271-377; 012-316-572-690-868; 013-453-722-080-430; 014-883-986-821-681; 017-909-343-964-517; 020-145-632-520-868; 020-510-524-790-02X; 025-962-391-084-146; 026-137-889-075-614; 027-000-561-537-802; 027-572-860-976-833; 027-626-738-585-418; 035-755-141-624-948; 039-099-899-362-884; 045-545-436-047-540; 046-002-744-164-103; 048-576-508-780-508; 051-023-380-967-397; 051-805-554-028-127; 055-596-167-999-908; 056-588-550-338-105; 057-492-293-624-425; 058-362-849-409-888; 060-050-949-940-069; 070-737-640-787-549; 075-382-570-872-95X; 080-285-260-391-786; 081-116-403-337-04X; 091-053-382-261-804; 092-161-018-516-131; 092-606-691-410-205; 107-503-047-052-428; 119-069-594-024-393; 121-241-692-587-118; 121-836-965-309-045; 122-711-510-051-743; 135-966-416-965-094; 136-861-118-403-064; 143-461-703-678-617; 159-569-945-309-57X; 159-591-013-503-082,40,true,cc-by,gold
023-189-299-897-795,"Correspondence between the Hamiltonian cycle problem and the quantum 
	   lattice gauge theory",2023-11-01,2023,journal article,Europhysics Letters,02955075; 12864854,IOP Publishing,France,Xiaopeng Cui; Yu Shi,"<jats:title>Abstract</jats:title>;                <jats:p>We propose the correspondence between the Hamiltonian cycle (HC) problem in graph theory and the quantum <jats:inline-formula id=""epl23100758ieqn3"">;                      <jats:tex-math/>;                      <jats:inline-graphic xmlns:xlink=""http://www.w3.org/1999/xlink"" xlink:href=""epl23100758ieqn3.gif"" xlink:type=""simple""/>;                   </jats:inline-formula> lattice gauge theory (QZ2LGT) defined on the lattice dual to that graph. For the QZ2LGT, when the coupling parameter <jats:italic>g</jats:italic> is less than the critical value <jats:italic>g</jats:italic>;                   <jats:sub>;                      <jats:italic>c</jats:italic>;                   </jats:sub>, the ground state is a superposition of all configurations with closed strings of same spins, which can be obtained by using an adiabatic quantum algorithm. A subsequent search for a HC among those closed strings solves the original HC problem. The method is demonstrated for random samples of small graphs.</jats:p>",144,4,48001,48001,Physics; Hamiltonian (control theory); Quantum mechanics; Spins; Superposition principle; Adiabatic quantum computation; Lattice (music); Ground state; Hamiltonian lattice gauge theory; Lattice field theory; Mathematical physics; Adiabatic process; Quantum; Lattice gauge theory; Gauge theory; Quantum computer; Mathematics; Condensed matter physics; Acoustics; Mathematical optimization,,,,National Natural Science Foundation of China,,http://dx.doi.org/10.1209/0295-5075/ad130b,,10.1209/0295-5075/ad130b,,,0,013-816-866-183-471; 015-180-251-287-882; 030-589-504-330-533; 034-720-638-333-330; 044-579-362-811-428; 061-979-598-909-228; 065-764-810-755-56X; 066-178-034-136-612; 069-473-606-773-619; 080-707-393-096-411; 087-197-536-533-680; 089-596-906-106-733; 093-609-434-011-836; 096-262-646-894-588; 106-888-366-159-162,1,true,cc-by-nc-nd,hybrid
023-300-514-172-387,Clifford Algebras Meet Tree Decompositions.,2018-07-30,2018,journal article,Algorithmica,01784617; 14320541,Springer Science and Business Media LLC,Germany,Michał Włodarczyk,"We introduce the non-commutative subset convolution—a convolution of functions useful when working with determinant-based algorithms. In order to compute it efficiently, we take advantage of Clifford algebras, a generalization of quaternions used mainly in the quantum field theory. We apply this tool to speed up algorithms counting subgraphs parameterized by the treewidth of a graph. We present an ;  $$O^*((2^\omega + 1)^{tw})$$;  -time algorithm for counting Steiner trees and an $$O^*((2^\omega + 2)^{tw})$$;  -time algorithm for counting Hamiltonian cycles, both of which improve the previously known upper bounds. These constitute also the best known running times of deterministic algorithms for decision versions of these problems and they match the best obtained running times for pathwidth parameterization under assumption $$\omega = 2$$;  .",81,2,497,518,Clifford algebra; Discrete mathematics; Treewidth; Parameterized complexity; Quaternion; Theory of computation; Omega; Mathematics; Pathwidth; Steiner tree problem; Combinatorics; Deterministic algorithm; Tree (descriptive set theory); Feedback vertex set,,,,Fundacja na rzecz Nauki Polskiej; European Research Council,https://link.springer.com/content/pdf/10.1007/s00453-018-0489-3.pdf https://europepmc.org/abstract/MED/30872883 https://link.springer.com/article/10.1007%2Fs00453-018-0489-3 https://dblp.uni-trier.de/db/journals/algorithmica/algorithmica81.html#Wlodarczyk19 https://www.ncbi.nlm.nih.gov/pmc/articles/PMC6386049 https://link.springer.com/article/10.1007/s00453-018-0489-3/fulltext.html http://arxiv.org/abs/1609.07134,http://dx.doi.org/10.1007/s00453-018-0489-3,30872883,10.1007/s00453-018-0489-3,3021494513; 2525537616,PMC6386049,0,007-435-166-767-242; 007-815-758-619-942; 020-712-906-501-006; 029-383-523-235-591; 035-322-795-963-259; 049-363-823-674-526; 067-757-783-874-893; 069-973-777-789-915; 070-381-911-304-621; 085-798-702-459-422; 086-571-552-024-57X; 099-025-100-952-256; 108-700-333-141-500; 112-372-331-141-667; 133-036-174-990-604; 143-935-844-354-95X; 151-595-372-785-277; 171-948-548-430-274; 180-997-899-641-847,11,true,cc-by,hybrid
023-387-242-249-313,P Systems Implementation: A Model of Computing for Biological Mitochondrial Rules using Object Oriented Programming,,2021,journal article,International Journal of Advanced Computer Science and Applications,21565570; 2158107x,The Science and Information Organization,,Mohammed M. Nasef; Bishoy El-Aarag; Amal Hashim; Passent M. El Kafrawy,"Membrane computing is a computational framework that depends on the behavior and structure of living cells. P systems are arising from the biological processes which occur in the living cells’ organelles in a non-deterministic and maximally parallel manner. This paper aims to build a powerful computational model that combines the rules of active and mobile membranes, called Mutual Dynamic Membranes (MDM). The proposed model will describe the biological mechanisms of the metabolic regulation of mitochondrial dynamics made by mitochondrial membranes. The behaviors of the proposed model regulate the mitochondrial fusion and fission processes based on the combination of P systems variants. The combination of different variants in our computational model and their high parallelism lead to provide the possibility for solving problems that belong to NP-complete classes in polynomial time in a more efficient way than other conventional methods. To evaluate this model, it was applied to solve the SAT problem and calculate a set of computational complexity results that approved the quality of our model. Another contribution of this paper, the biological models of mitochondrial is presented in the formal class relationship diagrams were designed and illustrated using Unified Modeling Language (UML). This mechanism will be used to define a new specification of membrane processes into Object-Oriented Programming (OOP) to add the functionality of a common programming methodology to solve a large category of NP-hard problems as an interesting initiative of future research.",12,10,,,Unified Modeling Language; Computational complexity theory; Software development process; Structure (mathematical logic); Class (computer programming); Time complexity; Computer science; Object-oriented programming; Theoretical computer science; Membrane computing,Computational biology; P systems; membranes fusionfission; mitochondria; Mutual Dynamic Membranes (MDM); NP-complete problems,,,,https://thesai.org/Downloads/Volume12No10/Paper_59-P_Systems_Implementation_A_Model_of_Computing.pdf https://thesai.org/Publications/ViewPaper?Volume=12&Issue=10&Code=IJACSA&SerialNo=59,http://dx.doi.org/10.14569/ijacsa.2021.0121059,,10.14569/ijacsa.2021.0121059,3209289656,,0,001-290-270-047-939; 002-436-552-508-129; 004-213-902-380-423; 004-801-240-067-403; 009-198-084-312-97X; 011-147-006-702-78X; 013-751-228-613-33X; 025-614-992-446-324; 027-152-815-403-568; 029-011-000-053-812; 041-052-817-522-682; 049-842-605-177-554; 078-529-832-779-652; 080-878-366-832-520; 093-135-087-514-516; 102-799-369-275-257; 103-015-259-799-293; 107-173-221-588-49X; 110-867-004-940-746; 111-076-093-380-650; 120-907-537-188-426; 125-283-483-804-295; 127-170-454-176-658; 136-439-584-446-711; 157-588-432-381-235; 164-506-661-451-286; 195-433-485-076-623,1,true,cc-by,gold
023-530-513-259-230,Quantum Lower Bounds for Distributed Network Computing,2012-07-22,2012,,,,,,Michael Elkin; Hartmut Klauck; Danupon Nanongkai; Gopal Pandurangan,"We study lower bounds for quantum distributed computing, where a set of nodes (representing quantum computers) interconnected by an underlying network consisting of (bandwidth-restricted) links, communicate using quantum communication. Nodes have unlimited computational power and may share an unlimited number of entangled qubits. Our main contribution is a simple uniform technique for proving lower bounds for quantum distributed algorithms. In particular, we identify a new quantum communication model called the Server model which provides a connection between distributed algorithms and communication complexity: it is strong enough to capture the hardness of several distributed computing problems, while weak enough that several hard problems in two-party communication complexity remain hard; to this end, we identify a set of communication complexity techniques that can be carried over to the Server model, namely techniques based on nonlocal games. We show that these techniques serve as a fundamental tool in proving lower bounds in quantum distributed computing. The new techniques help us to prove several non-trivial quantum distributed lower bounds (which are the first-known quantum bounds for fundamental global problems such as minimum spanning tree, shortest paths etc.), some of which are new even in the classical setting. First, it allows us to show that all previous classical lower bounds of more than twenty verification and optimization graph problems in [Das Sarma et al., STOC 11] also hold in the quantum setting. Many of these bounds are tight, implying a large class of problems that do not gain an advantage from quantum effects. Our results also imply the following new results in the classical communication models: (1) the first randomized lower bounds for Hamiltonian cycle and spanning tree verification problems in both the distributed computing and the communication complexity model, answering the open problem of Das Sarma et al. and subsuming many bounds in [Babai, Frankl, and Simon, FOCS 96], and (2) the first lower bound that is tight for all weight aspect ratios, matching previous upper bounds of [Elkin, STOC 04]. Submitted for a Regular Presentation. The full version of this paper can be found as [15] at http://arxiv.org/abs/1207.5211. ∗Department of Computer Science, Ben-Gurion University, Beer-Sheva, 84105, Israel. E-mail: elkinm@cs.bgu.ac.il. †Division of Mathematical Sciences, Nanyang Technological University, Singapore 637371 & Centre for Quantum Technologies, National University of Singapore, Singapore 117543. E-mail: hklauck@gmail.com. Research at the Centre for Quantum Technologies is funded by the Singapore Ministry of Education and the National Research Foundation. ‡Division of Mathematical Sciences, Nanyang Technological University, Singapore 637371. Work partially done while at University of Vienna, Austria. E-mail: danupon@gmail.com. §Division of Mathematical Sciences, Nanyang Technological University, Singapore 637371 & Department of Computer Science, Brown University, Providence, RI 02912, USA. E-mail: gopalpandurangan@gmail.com. Supported in part by the following research grants: Nanyang Technological University grant M58110000, Singapore MOE Academic Research Fund (AcRF) Tier 2 grant MOE2010-T2-2-082, and a grant from the US-Israeli Binational Science Foundation (BSF).",,,,,Distributed algorithm; Minimum spanning tree; Communication complexity; Quantum technology; Qubit; Computer science; Quantum information science; Quantum computer; Upper and lower bounds; Theoretical computer science,,,,,https://arxiv.org/pdf/1207.5211,https://arxiv.org/pdf/1207.5211,,,2759538414,,0,000-015-586-348-049; 000-594-838-228-828; 002-427-642-292-566; 004-284-279-116-580; 006-007-256-414-355; 007-297-944-992-137; 008-579-123-749-991; 010-698-038-228-810; 012-232-730-241-489; 019-067-530-099-690; 025-370-494-475-124; 025-587-501-578-381; 025-870-754-598-552; 027-327-339-219-218; 031-254-196-505-283; 038-164-316-240-423; 040-923-808-724-244; 042-086-868-081-241; 049-087-642-087-877; 050-393-582-236-199; 051-155-142-755-561; 055-565-711-817-812; 066-937-757-341-42X; 099-000-101-917-355; 100-378-416-870-983; 101-679-579-893-288; 102-213-840-762-807; 106-657-180-243-026; 110-591-482-190-041; 113-621-134-963-355; 119-375-956-192-526; 121-601-707-121-529; 137-086-404-058-400; 153-459-629-552-257; 164-115-353-474-971; 180-168-326-768-404,1,true,,unknown
023-772-561-447-318,Generalized probabilistic theories and conic extensions of polytopes,2014-12-11,2014,journal article,Journal of Physics A: Mathematical and Theoretical,17518113; 17518121,IOP Publishing,United Kingdom,Samuel Fiorini; Serge Massar; Manas Kumar Patra; Hans Raj Tiwary,"Generalized probabilistic theories (GPT) provide a general framework that includes classical and quantum theories. It is described by a cone C and its dual C*. We show that whether some one-way communication complexity problems can be solved within a GPT is equivalent to the recently introduced cone factorization of the corresponding communication matrix M. We also prove an analogue of Holevoʼs theorem: when the cone C is contained in , the classical capacity of the channel realized by sending GPT states and measuring them is bounded by . Polytopes and optimising functions over polytopes arise in many areas of discrete mathematics. A conic extension of a polytope is the intersection of a cone C with an affine subspace whose projection onto the original space yields the desired polytope. Extensions of polytopes can sometimes be much simpler geometric objects than the polytope itself. The existence of a conic extension of a polytope is equivalent to that of a cone factorization of the slack matrix of the polytope, on the same cone. We show that all polytopes whose vertices can be recognized by a polynomial size circuit, which includes as a special case the travelling salesman polytope and many other polytopes from combinatorial optimization, have small conic extension complexity when the cone is the completely positive cone. Using recent exponential lower bounds on the linear extension complexity of polytopes, this provides an exponential gap between the communication complexity of GPT based on the completely positive cone and classical communication complexity, and a conjectured exponential gap with quantum communication complexity. Our work thus relates the communication complexity of generalizations of quantum theory to questions of mainstream interest in the area of combinatorial optimization.",48,2,025302,,Conic section; Polytope model; Combinatorics; Discrete mathematics; Polytope; Uniform k 21 polytope; Communication complexity; Dual cone and polar cone; Cone (topology); Mathematics; Conic optimization,generalized probabilistic theories; polytope extensions; communication complexity PACS numbers: 03.65.Ta; 02.40.Ft; 89.70.Hj,,,,https://ui.adsabs.harvard.edu/abs/2015JPhA...48b5302F/abstract https://difusion.ulb.ac.be/vufind/Record/ULB-DIPOT:oai:dipot.ulb.ac.be:2013/186906/Details https://arxiv.org/abs/1310.4125 https://dblp.uni-trier.de/db/journals/corr/corr1310.html#FioriniMPT13 https://iopscience.iop.org/article/10.1088/1751-8113/48/2/025302 http://iopscience.iop.org/article/10.1088/1751-8113/48/2/025302 http://dblp.uni-trier.de/db/journals/corr/corr1310.html#FioriniMPT13,http://dx.doi.org/10.1088/1751-8113/48/2/025302,,10.1088/1751-8113/48/2/025302,2080072463,,0,002-051-919-127-019; 003-409-960-136-232; 003-805-752-976-004; 004-908-118-900-30X; 005-765-819-638-333; 009-966-309-593-362; 010-260-428-614-403; 010-392-965-043-313; 014-159-852-652-23X; 016-491-713-271-506; 023-665-794-132-874; 025-692-480-180-124; 026-525-049-556-604; 029-344-407-836-662; 031-211-595-192-122; 033-594-877-193-258; 036-392-053-708-603; 036-531-490-907-552; 036-995-301-031-199; 037-615-202-095-946; 037-664-189-486-475; 038-433-220-038-573; 041-725-295-886-430; 045-122-719-466-812; 049-077-488-285-904; 051-454-358-189-773; 060-863-630-554-13X; 061-946-778-214-406; 064-396-240-513-901; 066-045-560-819-297; 067-254-141-544-556; 067-613-385-954-844; 068-000-232-837-81X; 068-080-001-861-76X; 068-492-695-083-675; 070-435-475-528-899; 074-217-513-371-15X; 076-351-151-978-746; 079-538-370-607-872; 080-418-584-620-246; 080-477-723-513-951; 081-683-488-100-252; 095-024-338-859-297; 098-264-586-231-783; 102-305-304-282-250; 103-953-336-728-220; 104-244-117-841-21X; 104-952-239-540-13X; 108-509-088-065-878; 109-028-041-390-701; 113-427-566-319-740; 123-724-233-168-271; 125-812-815-757-124; 126-205-463-682-772; 126-815-171-116-531; 135-106-916-702-282; 135-648-109-053-518; 144-607-646-779-766; 145-575-214-099-081; 151-637-464-777-541; 153-271-393-937-702; 155-397-444-999-898; 156-486-427-830-346; 162-073-308-992-053; 168-788-495-210-658; 171-971-493-454-281; 176-890-376-860-720; 180-296-175-174-233; 182-900-725-155-418,12,true,cc-by,hybrid
024-559-481-229-402,SOFSEM - Theory of One Tape Linear Time Turing Machines,,2004,book chapter,Lecture Notes in Computer Science,03029743; 16113349,Springer Berlin Heidelberg,Germany,Kohtaro Tadaki; Tomoyuki Yamakami; Jack C. H. Lin,"A theory of one-tape linear-time Turing machines is quite different from its polynomial-time counterpart. This paper discusses the computational complexity of one-tape Turing machines of various machine types (deterministic, nondeterministic, reversible, alternating, probabilistic, counting, and quantum Turing machines) that halt in time O(n), where the running time of a machine is defined as the height of its computation tree. We also address a close connection between one-tape linear-time Turing machines and finite state automata.",,,335,348,Discrete mathematics; Universal Turing machine; Probabilistic Turing machine; Non-deterministic Turing machine; DTIME; Finite-state machine; Multitape Turing machine; Nondeterministic algorithm; Description number; Computational complexity theory; Alternating Turing machine; 2-EXPTIME; Quantum Turing machine; PSPACE; Linear speedup theorem; NSPACE; Turing machine examples; Computation tree; Turing machine; Super-recursive algorithm; DSPACE; Computer science; Time hierarchy theorem; Register machine; Turing reduction,,,,,https://dblp.uni-trier.de/db/conf/sofsem/sofsem2004.html#TadakiYL04 https://core.ac.uk/display/23070001 http://dblp.uni-trier.de/db/conf/sofsem/sofsem2004.html#TadakiYL04,http://dx.doi.org/10.1007/978-3-540-24618-3_29,,10.1007/978-3-540-24618-3_29,1526571572,,0,004-465-342-512-627; 006-987-038-955-088; 009-011-268-461-977; 015-997-860-896-874; 019-716-124-662-908; 023-561-980-293-800; 023-620-349-172-465; 024-137-364-692-502; 024-382-108-309-876; 026-511-718-687-891; 031-129-941-909-833; 031-909-553-637-650; 034-139-893-566-087; 039-135-810-880-761; 039-265-107-666-021; 044-540-933-069-477; 047-438-704-942-082; 049-205-677-000-094; 055-478-499-168-492; 058-613-488-531-258; 064-588-034-878-033; 068-508-686-687-374; 069-615-277-306-841; 076-783-085-604-867; 077-438-554-657-566; 082-968-632-201-126; 083-827-035-174-470; 092-402-400-548-833; 092-622-455-134-325; 103-832-461-998-843; 107-930-889-006-563; 111-367-584-855-358; 116-127-361-611-398; 125-196-146-041-754; 125-595-314-900-764; 126-506-873-731-919; 129-371-399-926-797; 144-922-101-338-389; 156-718-872-704-022; 160-503-830-080-414; 181-411-989-710-354,9,true,,green
024-617-904-036-649,"Packing lines, planes, etc.: packings in Grassmannian spaces",,1996,journal article,Experimental Mathematics,10586458; 1944950x,Informa UK Limited,United Kingdom,John H. Conway; R. H. Hardin; Neil J. A. Sloane,"We addressthe question: How should N n-dimensional subspaces of m-dimensional Euclidean space be arranged so that they are as far apart as possible? The resuIts of extensive computations for modest values of N, n, m are described, as well as a reformulation of the problem that was suggested by these computations. The reformulation gives a way to describe n-dimensional subspaces of m-space as points on a sphere in dimension ½(m–l)(m+2), which provides a (usually) lowerdimensional representation than the Plucker embedding, and leads to a proof that many of the new packings are optimal. The results have applications to the graphical display of multidimensional data via Asimov's grand tour method.",5,2,139,159,Combinatorics; Linear subspace; Grassmannian; Euclidean space; Fusion frame; Equiangular lines; Dimension (graph theory); Mathematics; Plücker embedding; Representation (mathematics),,,,,https://projecteuclid.org/journals/experimental-mathematics/volume-5/issue-2/Packing-lines-planes-etc-packings-in-Grassmannian-spaces/em/1047565645.full https://doi.org/10.1080/10586458.1996.10504585 https://dblp.uni-trier.de/db/journals/em/em5.html#ConwayHS96 https://www.tandfonline.com/doi/abs/10.1080/10586458.1996.10504585 https://core.ac.uk/display/21256190 http://projecteuclid.org/euclid.em/1047565645 https://eudml.org/doc/226058 https://stat.duke.edu/~sayan/SAMSI/lec/conway.pdf https://projecteuclid.org/download/pdf_1/euclid.em/1047565645,http://dx.doi.org/10.1080/10586458.1996.10504585,,10.1080/10586458.1996.10504585,2035469609,,20,002-247-400-011-559; 002-296-505-657-357; 002-412-338-801-854; 003-674-053-750-578; 003-761-047-935-221; 012-022-316-481-369; 013-987-576-654-745; 014-480-233-475-933; 033-282-475-177-64X; 041-003-281-444-856; 042-144-692-517-752; 044-424-194-160-980; 048-339-299-830-767; 059-332-211-483-420; 059-553-763-272-698; 063-654-037-445-82X; 074-374-702-916-701; 075-243-658-373-821; 076-539-187-568-479; 078-928-514-414-218; 087-025-887-807-611; 089-187-129-442-486; 095-984-802-891-302; 097-672-007-940-152; 098-440-718-987-858; 099-823-072-060-029; 105-574-219-448-206; 111-658-558-854-722; 115-715-701-304-074; 119-847-289-097-252; 127-060-538-031-889; 140-638-690-500-458; 145-826-928-485-391; 149-672-434-812-15X; 155-097-730-987-156; 155-774-086-061-680; 173-809-685-832-416; 178-261-257-393-366; 179-948-096-097-845; 193-468-219-503-60X; 198-096-034-398-628; 198-788-352-388-609,786,true,,green
