Lens ID,Title,Date Published,Publication Year,Publication Type,Source Title,ISSNs,Publisher,Source Country,Author/s,Abstract,Volume,Issue Number,Start Page,End Page,Fields of Study,Keywords,MeSH Terms,Chemicals,Funding,Source URLs,External URL,PMID,DOI,Microsoft Academic ID,PMCID,Citing Patents Count,References,Citing Works Count,Is Open Access,Open Access License,Open Access Colour
119-551-724-023-82X,Actions of the absolute Galois group,2016-05-31,2016,book chapter,IRMA Lectures in Mathematics and Theoretical Physics,25235133; 25235141,EMS Press,,Norbert A'Campo; Lizhen Ji; Athanase Papadopoulos,"HAL is a multi-disciplinary open access archive for the deposit and dissemination of scientific research documents, whether they are published or not. The documents may come from teaching and research institutions in France or abroad, or from public or private research centers. L'archive ouverte pluridisciplinaire HAL, est destinée au dépôt et à la diffusion de documents scientifiques de niveau recherche, publiés ou non, émanant des établissements d'enseignement et de recherche français ou étrangers, des laboratoires publics ou privés.",,,397,435,Absolute (philosophy); Absolute Galois group; Group (periodic table); Mathematics; Galois group; Pure mathematics; Physics; Philosophy; Theology; Quantum mechanics,AMS Mathematics Subject Classification: 32G13; 32G15; 14H15; 14C05; 18A22 Teichmüller tower; profinite group; ansolute Galois group; dessin d'enfant; Grothendieck-Teichmüller group; two-level principle; reconstruction principle; cartographic group; actions of the Galois group; Postnikov tower; stable compactification,,,,,http://dx.doi.org/10.4171/161-1/13,,10.4171/161-1/13,,,0,,3,true,,green
120-389-697-934-662,A Hybrid Solution Method for the Capacitated Vehicle Routing Problem Using a Quantum Annealer,2019-06-25,2019,journal article,Frontiers in ICT,2297198x,Frontiers Media SA,,Sebastian Feld; Christoph Roch; Thomas Gabor; Christian Seidel; Florian Neukart; Isabella Galter; Wolfgang Mauerer; Claudia Linnhoff-Popien,"The Capacitated Vehicle Routing Problem (CVRP) is an NP-optimization problem (NPO) that has been of great interest for decades for both, science and industry. The CVRP is a variant of the vehicle routing problem characterized by capacity constrained vehicles. The aim is to plan tours for vehicles to supply a given number of customers as efficiently as possible. The problem is the combinatorial explosion of possible solutions, which increases superexponentially with the number of customers. Classical solutions provide good approximations to the globally optimal solution. D-Wave's quantum annealer is a machine designed to solve optimization problems. This machine uses quantum effects to speed up computation time compared to classic computers. The problem on solving the CVRP on the quantum annealer is the particular formulation of the optimization problem. For this, it has to be mapped onto a quadratic unconstrained binary optimization (QUBO) problem. Complex optimization problems such as the CVRP can be translated to smaller subproblems and thus enable a sequential solution of the partitioned problem. This work presents a quantum-classic hybrid solution method for the CVRP. It clarifies whether the implemenation of such a method pays off in comparison to existing classical solution methods regarding computation time and solution quality. Several approaches to solving the CVRP are elaborated, the arising problems are discussed, and the results are evaluated in terms of solution quality and computation time.",6,,13,,Combinatorial explosion; Vehicle routing problem; Mathematical optimization; Optimization problem; Quadratic unconstrained binary optimization; Computer science; Computation; Speedup; Routing (electronic design automation); Quantum annealing; Hybrid solution; Quantum,capacitated vehicle routing problem; CVRP; quantum annealing; hybrid solution method; clustering; routing,,,,https://www.frontiersin.org/article/10.3389/fict.2019.00013/full https://ui.adsabs.harvard.edu/abs/2018arXiv181107403F/abstract https://www.frontiersin.org/articles/10.3389/fict.2019.00013/full https://arxiv.org/pdf/1811.07403 https://doi.org/10.3389/fict.2019.00013 https://www.arxiv-vanity.com/papers/1811.07403/ http://arxiv.org/abs/1811.07403,http://dx.doi.org/10.3389/fict.2019.00013,,10.3389/fict.2019.00013,3102870135; 2901067438,,4,001-027-893-504-86X; 002-270-633-398-307; 002-278-478-263-141; 006-054-899-531-469; 010-304-156-090-889; 010-377-046-867-56X; 011-559-329-570-110; 012-768-733-851-392; 017-243-444-796-577; 018-592-028-261-508; 021-023-291-493-937; 021-220-839-599-423; 022-174-958-968-430; 022-834-465-400-688; 030-311-074-163-061; 030-311-314-578-937; 035-549-286-612-908; 045-187-004-869-746; 055-166-568-133-97X; 059-468-041-332-429; 067-269-362-448-922; 069-484-636-150-790; 084-683-616-929-196; 088-130-289-612-890; 097-150-384-225-236; 098-005-195-601-584; 103-238-060-152-191; 105-059-923-153-077; 111-269-048-515-510; 114-110-795-755-504; 120-271-748-897-539; 120-592-630-176-987; 128-347-303-220-137; 135-321-078-805-320; 140-165-363-293-87X; 141-372-846-769-324; 153-928-088-116-24X; 154-194-313-147-63X; 165-475-160-946-237; 176-680-276-784-446,171,true,,gold
120-397-684-902-055,Robust Topological Order in Fermionic Z(2) Gauge Theories: From Aharonov-Bohm Instability to Soliton-Induced Deconfinement,2020-10-09,2020,journal article,Physical Review X,21603308,American Physical Society (APS),United States,Daniel González-Cuadra; Luca Tagliacozzo; Maciej Lewenstein; Alejandro Bermudez,"New methods for producing topological order in a material could do so under more relaxed conditions than is typically required, which could help in the development of fault-tolerant quantum computation.",10,4,041007,,Physics; Gauge theory; Instability; Development (topology); Deconfinement; Theoretical physics; Topological order; Quantum computer; Soliton; Quantum fluctuation; Quantum simulator; Frustration; Fermion; Spin-½; Quantum information; Ising model; Quantum,Atomic and Molecular Physics; Condensed Matter Physics; Particles and Fields,,,Horizon 2020 Framework Programme; H2020 Marie Skłodowska-Curie Actions; Ministerio de Economía y Competitividad; State Research Agency AEI; State Research Agency AEI; European Social Fund; Generalitat de Catalunya; Agència de Gestió d’Ajuts Universitaris i de Recerca; H2020 European Research Council; European Regional Development Fund; European Regional Development Fund; Narodowe Centrum Nauki; Fundaci Cellex; Ramón y Cajal program; Ramón y Cajal program; Plan Nacional Generación de Conocimiento,http://diposit.ub.edu/dspace/bitstream/2445/179159/1/704253.pdf https://link.aps.org/doi/10.1103/PhysRevX.10.041007 http://diposit.ub.edu/dspace/handle/2445/179159 https://ui.adsabs.harvard.edu/abs/2020PhRvX..10d1007G/abstract https://journals.aps.org/prx/abstract/10.1103/PhysRevX.10.041007 https://link.aps.org/pdf/10.1103/PhysRevX.10.041007,http://dx.doi.org/10.1103/physrevx.10.041007,,10.1103/physrevx.10.041007,3092768792; 3099720569; 3005979228,,0,000-147-791-537-521; 000-452-385-017-249; 001-138-078-336-734; 002-684-337-252-709; 004-225-153-995-831; 004-716-696-528-523; 005-336-844-483-657; 005-524-649-143-460; 005-753-076-625-006; 006-237-680-333-814; 006-459-420-308-085; 007-085-297-872-563; 008-132-801-909-587; 008-649-906-787-469; 008-656-760-711-327; 008-992-216-814-464; 009-231-342-888-19X; 009-264-793-042-311; 011-009-118-690-490; 012-546-575-450-353; 013-977-096-154-515; 014-127-544-135-971; 014-487-761-556-114; 015-180-251-287-882; 015-186-995-902-654; 016-581-996-658-362; 018-929-548-332-518; 019-551-665-657-906; 019-674-548-574-458; 021-523-588-653-98X; 021-546-298-875-64X; 023-561-222-687-720; 023-853-538-979-564; 024-340-539-768-50X; 025-576-752-600-017; 026-688-442-881-581; 026-925-884-247-20X; 029-531-488-831-700; 029-886-116-942-357; 031-245-452-229-667; 032-145-399-104-088; 032-146-462-178-587; 033-548-235-713-197; 035-757-699-498-337; 036-627-301-867-675; 037-620-103-088-595; 038-719-295-304-93X; 039-962-287-302-957; 042-340-635-565-799; 042-565-879-217-413; 046-831-560-001-260; 046-845-656-145-821; 047-962-158-796-161; 049-516-636-437-036; 050-708-395-865-057; 051-066-109-841-607; 051-744-959-458-903; 053-856-455-712-161; 053-958-592-659-739; 055-327-791-187-545; 055-869-808-258-351; 057-103-743-801-520; 057-657-732-268-534; 061-590-830-812-303; 061-599-354-219-090; 064-285-667-035-353; 065-137-567-285-664; 065-775-098-111-376; 066-178-034-136-612; 066-642-599-208-384; 067-015-348-646-631; 067-704-931-981-721; 067-867-416-379-388; 079-450-460-831-783; 080-707-393-096-411; 080-782-559-657-945; 086-108-620-540-345; 088-934-053-423-210; 093-609-434-011-836; 097-230-036-044-826; 098-546-527-408-580; 098-646-505-552-483; 099-866-386-141-382; 103-216-304-135-949; 103-294-855-934-02X; 103-441-375-606-622; 104-206-015-919-584; 105-043-915-200-471; 105-315-026-317-270; 106-206-532-979-561; 110-887-122-146-568; 111-313-112-787-998; 112-918-978-731-803; 113-766-967-249-516; 117-499-495-813-159; 119-269-065-958-920; 121-547-789-296-415; 125-191-524-950-574; 125-211-998-089-507; 125-692-812-825-685; 127-594-827-240-835; 131-360-179-526-757; 140-746-019-762-783; 145-215-980-146-650; 149-857-687-572-298; 154-118-321-657-440; 179-568-360-847-752; 184-251-254-174-588; 185-792-420-119-479,25,true,cc-by,gold
121-063-486-343-586,Even subgraph expansions for the polynomial of cubic plane maps,,1991,journal article,"Journal of Combinatorial Theory, Series B",00958956; 10960902,Elsevier BV,United States,François Jaeger,"We give two new expansions of the flow polynomial F(G,λ) of a cubic plane map G. The first expansion is in terms of oriented even subgraphs of G, and the second one is an unoriented version of the first. These expansions depend on topological properties of the plane embedding and cannot in general be extended to non-planar graphs. There are two exceptions: for λ = 4 our formulas degenerate to a triviality, and for λ = 0 we obtain a simple expansion valid for general cubic graphs. The Beraha numbers appear naturally as special values for our expansions.",52,2,259,273,Cubic graph; Combinatorics; Plane (geometry); Simple (abstract algebra); Triviality; Mathematics; Flow (mathematics); Embedding; Degenerate energy levels; Polynomial,,,,,https://dblp.uni-trier.de/db/journals/jct/jctb52.html#Jaeger91 http://www.sciencedirect.com/science/article/pii/009589569190067T https://www.sciencedirect.com/science/article/pii/009589569190067T,http://dx.doi.org/10.1016/0095-8956(91)90067-t,,10.1016/0095-8956(91)90067-t,2015438399,,0,001-331-647-080-981; 002-466-925-750-098; 005-022-070-692-399; 007-087-126-687-426; 045-836-486-270-177; 049-604-584-853-141; 072-837-527-408-720; 082-404-421-702-090; 082-522-286-327-394; 097-356-595-788-702; 098-861-941-376-457; 107-250-870-551-087; 110-781-826-115-940; 111-627-027-860-486; 115-212-131-491-01X; 121-749-536-738-487; 133-213-317-648-65X; 166-758-979-610-869; 174-159-243-823-146,9,true,elsevier-specific: oa user license,unknown
121-087-292-708-571,Conical $SL(3)$ foams,2022-04-06,2022,journal article,Journal of Combinatorial Algebra,24156302; 24156310,European Mathematical Society - EMS - Publishing House GmbH,,Mikhail Khovanov; Louis-Hadrien Robert,"<jats:p>;                     In the unoriented;                     <jats:inline-formula>;                       <jats:tex-math>SL(3)</jats:tex-math>;                     </jats:inline-formula>;                     foam theory, singular vertices are generic singularities of two-dimensional complexes. Singular vertices have neighborhoods homeomorphic to cones over the one-skeleton of the tetrahedron, viewed as a trivalent graph on the two-sphere. In this paper we consider foams with singular vertices with neighborhoods homeomorphic to cones over more general planar trivalent graphs. These graphs are subject to suitable conditions on their Kempe equivalence Tait coloring classes and include the dodecahedron graph. In this modification of the original homology theory it is straightforward to show that modules associated to the dodecahedron graph are free of rank 60, which is still an open problem for the original unoriented;                     <jats:inline-formula>;                       <jats:tex-math>SL(3)</jats:tex-math>;                     </jats:inline-formula>;                     foam theory.;                   </jats:p>",6,1,79,108,,2020 Mathematics Subject Classification. Primary 05C10; 05C15; 57M15; Secondary 57K16 Foams; Tait colorings; planar graphs,,,,,http://dx.doi.org/10.4171/jca/61,,10.4171/jca/61,,,0,,1,true,cc-by,gold
122-671-156-293-227,Unconstrained binary models of the travelling salesman problem variants for quantum optimization,2022-01-22,2022,journal article,Quantum Information Processing,15700755; 15731332,Springer Science and Business Media LLC,Netherlands,Özlem Salehi; Adam Glos; Jarosław Adam Miszczak,"<jats:title>Abstract</jats:title><jats:p>Quantum computing is offering a novel perspective for solving combinatorial optimization problems. To fully explore the possibilities offered by quantum computers, the problems need to be formulated as unconstrained binary models, taking into account limitation and advantages of quantum devices. In this work, we provide a detailed analysis of the travelling salesman problem with time windows (TSPTW) in the context of solving it on a quantum computer. We introduce quadratic unconstrained binary optimization and higher-order binary optimization formulations of this problem. We demonstrate the advantages of edge-based and node-based formulations of the TSPTW problem. Additionally, we investigate the experimental realization of the presented methods on a quantum annealing device. The provided results pave the path for utilizing quantum computer for a variety of real-world tasks which can be cast in the form of travelling salesman problem with time windows.</jats:p>",21,2,,,,,,,polska akademia nauk; polska akademia nauk,,http://dx.doi.org/10.1007/s11128-021-03405-5,,10.1007/s11128-021-03405-5,,,0,005-218-777-232-032; 005-854-893-842-783; 008-468-343-915-662; 009-921-682-711-938; 010-979-271-512-130; 013-675-172-148-923; 014-142-052-155-031; 016-721-146-275-113; 018-592-028-261-508; 021-023-291-493-937; 022-436-422-699-591; 022-974-742-539-552; 025-970-882-111-575; 026-095-769-881-31X; 029-803-646-760-538; 031-222-455-721-700; 040-412-937-613-570; 047-244-357-955-835; 048-369-827-117-242; 049-899-451-008-201; 055-629-078-931-029; 058-515-771-398-289; 060-670-590-503-141; 064-589-883-790-268; 065-185-234-482-658; 069-484-636-150-790; 070-749-237-427-971; 084-137-639-757-78X; 084-783-849-061-795; 086-527-459-418-437; 092-368-576-575-484; 093-842-068-278-231; 142-987-083-038-60X; 149-102-925-676-709; 168-210-750-523-395,54,true,cc-by,hybrid
123-727-380-989-25X,Atom Cavity Encoding for NP-Complete Problems,2024-07-16,2024,preprint,arXiv (Cornell University),,,,Meng Ye; Xiaopeng Li,"We consider an atom-cavity system having long-range atomic interactions mediated by cavity modes. It has been shown that quantum simulations of spin models with this system can naturally be used to solve number partition problems. Here, we present encoding schemes for numerous NP-complete problems, encompassing the majority of Karp's 21 NP-complete problems. We find a number of such computation problems can be encoded by the atom-cavity system at a linear cost of atom number. There are still certain problems that cannot be encoded by the atom-cavity as efficiently, such as quadratic unconstrained binary optimization (QUBO), and the Hamiltonian cycle. For these problems, we provide encoding schemes with a quadratic or quartic cost in the atom number. We expect this work to provide important guidance to search for the practical quantum advantage of the atom-cavity system in solving NP-complete problems. Moreover, the encoding schemes we develop here may also be adopted in other optical systems for solving NP-complete problems, where a similar form of Mattis-type spin glass Hamiltonian as in the atom-cavity system can be implemented.",,,,,Encoding (memory); Atom (system on chip); Computer science; Chemistry; Algorithm; Computational biology; Biology; Artificial intelligence; Parallel computing,,,,,https://arxiv.org/abs/2407.11851,http://dx.doi.org/10.48550/arxiv.2407.11851,,10.48550/arxiv.2407.11851,,,0,,0,true,,green
124-971-021-640-954,"Algorithmic QUBO formulations for
            <i>k</i>
            -SAT and hamiltonian cycles",2022-07-09,2022,conference proceedings article,Proceedings of the Genetic and Evolutionary Computation Conference Companion,,ACM,,Jonas Nüßlein; Thomas Gabor; Claudia Linnhoff-Popien; Sebastian Feld,"&lt;p&gt;Quadratic Unconstrained Binary Optimization (QUBO) can be seen as a generic language for optimization problems. QUBOs attract particular attention since they can be solved with quantum hardware, like quantum annealers or quantum gate computers running QAOA. In this paper, we present two novel QUBO formulations for k-SAT and Hamiltonian Cycles that scale significantly better than existing approaches. For k-SAT we reduce the growth of the QUBO matrix from O(k) to O(log(k)). For Hamiltonian Cycles the matrix no longer grows quadratically in the number of nodes, as currently, but linearly in the number of edges and logarithmically in the number of nodes. We present these two formulations not as mathematical expressions, as most QUBO formulations are, but as meta-algorithms that facilitate the design of more complex QUBO formulations and allow easy reuse in larger and more complex QUBO formulations.&lt;/p&gt;",,,2240,2246,Quadratic unconstrained binary optimization; Quadratic growth; Hamiltonian (control theory); Quadratic equation; Quantum annealing; Quantum; Computer science; Quantum computer; Binary number; Mathematics; Mathematical optimization; Algorithm; Arithmetic; Physics; Quantum mechanics; Geometry,QUBO; Ising; Satisfiability; 𝑘-SAT; Hamiltonian Cycle,,,,https://arxiv.org/pdf/2204.13539 http://arxiv.org/abs/2204.13539,http://dx.doi.org/10.1145/3520304.3533952,,10.1145/3520304.3533952,,,0,000-423-022-535-79X; 001-575-536-461-82X; 015-380-091-199-205; 018-592-028-261-508; 023-899-945-364-886; 024-319-720-717-41X; 024-590-688-799-109; 024-730-421-222-759; 035-549-286-612-908; 063-639-440-263-414; 065-364-641-954-185; 088-992-343-634-978; 089-043-165-579-356; 131-045-608-027-738; 134-097-905-167-212; 136-071-899-241-806; 146-740-566-757-175,17,true,,green
126-035-094-664-392,"Chromatic polynomial, q-binomial counting and colored Jones function",,2007,journal article,Advances in Mathematics,00018708; 10902082,Elsevier BV,United States,Martin Loebl,"We define a q-chromatic function and q-dichromate on graphs and compare it with existing graph functions. Then we study in more detail the class of general chordal graphs. This is partly motivated by the graph isomorphism problem. Finally we relate the q-chromatic function to the colored Jones function of knots. This leads to a curious expression of the colored Jones function of a knot diagram as a chromatic operator applied to a power series whose coefficients are linear combinations of long chord diagrams. Chromatic operators are directly related to weight systems by the work of Chmutov, Duzhin, Lando and Noble, Welsh.",211,2,546,565,Combinatorics; Discrete mathematics; Chromatic polynomial; Tutte polynomial; Chordal graph; Mathematics; Graph isomorphism; Graph property; Foster graph; Graph homomorphism; Friendship graph,MSC: primary 05A30; secondary 57N10 Chromatic polynomial; Tutte polynomial; Quantum binomial identity; Colored Jones function,,,,https://core.ac.uk/display/81211664 https://dialnet.unirioja.es/servlet/articulo?codigo=2296872 https://www.sciencedirect.com/science/article/pii/S0001870806003197 https://documat.unirioja.es/servlet/articulo?codigo=2296872 https://www.sciencedirect.com/science/article/abs/pii/S0001870806003197 https://core.ac.uk/download/pdf/81211664.pdf,http://dx.doi.org/10.1016/j.aim.2006.09.001,,10.1016/j.aim.2006.09.001,2028153041,,0,002-192-611-939-191; 008-723-893-398-722; 017-503-084-900-884; 020-869-962-318-463; 021-106-730-169-594; 027-681-928-285-194; 027-931-931-217-570; 029-327-249-822-251; 030-810-650-401-045; 033-119-206-486-102; 038-883-592-039-567; 069-645-310-091-983; 079-895-624-585-032; 082-522-286-327-394; 120-756-167-666-797; 125-146-467-392-728; 154-415-934-762-391; 169-106-863-447-508; 186-311-716-205-006,9,true,elsevier-specific: oa user license,unknown
128-004-768-774-928,Classical cryptographic protocols in a quantum world,2015-06-25,2015,journal article,International Journal of Quantum Information,02197499; 17936918,World Scientific Pub Co Pte Lt,Singapore,Sean Hallgren; Adam Smith; Fang Song,"Cryptographic protocols, such as protocols for secure function evaluation (SFE), have played a crucial role in the development of modern cryptography. The extensive theory of these protocols, however, deals almost exclusively with classical attackers. If we accept that quantum information processing is the most realistic model of physically feasible computation, then we must ask: What classical protocols remain secure against quantum attackers? Our main contribution is showing the existence of classical two-party protocols for the secure evaluation of any polynomial-time function under reasonable computational assumptions (for example, it suffices that the learning with errors problem be hard for quantum polynomial time). Our result shows that the basic two-party feasibility picture from classical cryptography remains unchanged in a quantum world.",13,4,1550028,,Cryptography; Development (topology); Learning with errors; Time complexity; Cryptographic protocol; Computer science; Computation; Function (engineering); Theoretical computer science; Quantum; Quantum cryptography; Cryptographic primitive; Commitment scheme,,,,,http://ui.adsabs.harvard.edu/abs/2015IJQI...1350028H/abstract https://www.worldscientific.com/doi/abs/10.1142/S0219749915500288 https://pennstate.pure.elsevier.com/en/publications/classical-cryptographic-protocols-in-a-quantum-world-2 http://arxiv.org/abs/1507.01625,http://dx.doi.org/10.1142/s0219749915500288,,10.1142/s0219749915500288,3101600503; 2618912166,,0,005-755-581-208-050; 009-129-402-304-571; 012-666-237-599-071; 019-234-607-024-060; 023-371-181-440-918; 025-023-982-054-074; 029-265-736-955-384; 029-454-841-843-563; 030-250-935-152-684; 031-036-478-997-022; 031-167-711-976-819; 033-503-137-838-093; 035-563-435-761-546; 042-113-447-734-292; 047-687-714-863-449; 048-091-418-949-239; 048-578-229-692-408; 051-619-118-174-946; 059-340-901-477-087; 060-444-501-698-982; 061-024-765-302-481; 062-980-337-109-905; 066-848-841-168-186; 071-250-175-475-081; 074-546-362-187-212; 079-643-062-267-786; 084-136-384-150-366; 093-018-125-696-195; 107-078-433-801-816; 107-355-269-226-946; 107-884-343-664-711; 112-365-281-890-639; 113-477-792-458-402; 114-866-300-137-641; 122-166-310-255-070; 131-878-683-481-101; 161-559-497-496-502; 166-661-488-523-911; 167-724-217-257-828; 175-596-411-803-171,14,true,,green
128-170-606-731-515,Graphical functions and single-valued multiple polylogarithms,,2014,journal article,Communications in Number Theory and Physics,19314523; 19314531,International Press of Boston,United States,Oliver Schnetz,Graphical functions are single-valued complex functions which arise from Feynman amplitudes. We study their properties and use their connection to multiple polylogarithms to calculate Feynman periods. For the zig-zag and two more families of phi^4 periods we give exact results modulo products. These periods are proved to be expressible as integer linear combinations of single-valued multiple polylogarithms evaluated at one. For the larger family of 'constructible' graphs we give an algorithm that allows one to calculate their periods by computer algebra. The theory of graphical functions is used to prove the zig-zag conjecture.,8,4,589,675,Symbolic computation; Discrete mathematics; Conjecture; Mathematics; Connection (mathematics); Modulo; Feynman diagram; Graph theory; Linear combination; Integer (computer science),,,,,https://www.intlpress.com/site/pub/files/_fulltext/journals/cntp/2014/0008/0004/CNTP-2014-0008-0004-a001.pdf https://www.intlpress.com/site/pub/pages/journals/items/cntp/content/vols/0008/0004/a001/ https://ui.adsabs.harvard.edu/abs/2013arXiv1302.6445S/abstract http://arxiv.org/abs/1302.6445,http://dx.doi.org/10.4310/cntp.2014.v8.n4.a1,,10.4310/cntp.2014.v8.n4.a1,2964146312,,0,,162,true,,green
